{
  "schema_version": 1,
  "candidate": {
    "schema_version": 1,
    "candidate_version": "0.8.6",
    "parent_version": "0.8.5",
    "source_revision": "git:e32ef14 + uncommitted candidate (working tree at evaluation time: 0.8.5 ui-track delta + 0.8.6 expression-scope delta)",
    "hypothesis": "【parent 注】0.8.5（ui 轨候选）已评估完毕待同一发布门批准；本候选 delta 叠加其上，四文件与 0.8.5 改动面不重叠（document-chain.md 仅条款区，ui 轨节未动）。【digest 注】artifact_digest 覆盖候选树副本（未提交工作树），排除 .zcode 符号链接目录与 .agentflow-records.sqlite3。主体假设：表达纪律三件套（document-chain.md 条款、模板写前提醒、doc_chain.py C12/C13）与 reviewer 文档模式全部锚定文档链，会话交付给用户的独立书面产物（分析报告/状态汇报）零覆盖——用户 2026-09-22 九组黑话反馈中两组是条款未点名的新形态：代号一次定义后裸用作正文持续主语（A 桶/D 桶/G 桶）、数据库模式词直搬散文主语（prepared 会话/Run）。修复 = 条款增两条形态规则 + 作用域显式扩展到会话交付物（配 supervisor 写前自查职责与 reviewer 指派路径两个可达面）+ doc_chain.py 新增 C14 代号裸用与 --file 单文件机器检查入口。评测口径：self-test 26→38 全绿不回归；validate.py all 9 项 PASS；unittest 155 OK；isolation blocked=[]；真实缺陷语料（aiwork 两份分析报告）--file 检测——AIPPT 报告 C14 命中>0（期望捕获代号裸用形态）、姊妹报告与 Youc『IP 桶』文件零误报（precision 护栏）；基线无 --file 入口故两项语料 case 记 not-measurable（accepted=false）。method-level change; evals/business 切片不覆盖会话交付物分析报告面——release record 须记 measurement: none (method-level change, no instrumented business task)",
    "evidence_ids": [
      "EP-20260922-002"
    ],
    "changed_components": [
      "skills/agentflow/references/document-chain.md",
      "skills/agentflow/references/roles.md",
      "agents/reviewer.md",
      "tools/lab/doc_chain.py"
    ],
    "risk_class": "low",
    "evaluation_suite_revision": "git:<working-tree>:tools/lab/doc_chain.py --self-test (38 cases) + validate.py all + unittest discover + --file corpus lint (aiwork analysis reports, outside-repo fixtures)",
    "primary_metrics": [
      "doc_chain_self_test_pass (38/38, 基线 26/26 行为不回归)",
      "defect_corpus_detection (--file 对 AIPPT 报告 C14 命中 4 处 :40/:274/:280/:648; 基线无该能力)",
      "corpus_precision_guard (姊妹报告 + Youc IP 桶文件 0 finding)",
      "expression_scope_text_present (条款形态规则+作用域声明、roles.md 职责、reviewer.md 检查项由独立 evaluator 内容核对)"
    ],
    "guardrails": [
      "validate.py all 全绿（schemas/examples/evals/artifacts/mock/protected/manifests/docs/tests）",
      "isolation.py check-diff blocked=[]",
      "既有 C1-C13 自测 case 不回归（26 个原 case 全部保留）",
      "C12/C13 finding 字符串与行为逐字不变（重构进共享函数但语义零变更）",
      "C14 无真实语料误报（组/档形态不收的宽度决策由正反例自测钉死）"
    ],
    "rejection_criteria": [
      "任一 guardrail 失败",
      "C14 在干净语料或真实业务仓文件上出现误报",
      "作用域声明或任一形态规则缺失（evaluator 内容核对不过）",
      "既有 26 case 或 155 单测出现新失败"
    ],
    "protected_slices": [
      "role-selection",
      "architecture-and-safety",
      "artifact-verification"
    ],
    "artifact_digest": "sha256:4713e1a2050805d1aae9322c2ad04b30a9c6bef73fcd2cb9aaa8f80d55148121"
  },
  "baseline_results": {
    "result_id": "RL-0.8.6-baseline",
    "source_kind": "baseline",
    "source_revision": "git:e32ef14 + uncommitted 0.8.5 delta (pre-0.8.6 working tree)",
    "artifact_digest": "sha256:4713e1a2050805d1aae9322c2ad04b30a9c6bef73fcd2cb9aaa8f80d55148121",
    "suite_revision": "tools/lab/doc_chain.py --self-test (26 baseline cases / 38 candidate cases) + validate.py all + unittest discover + --file corpus lint (aiwork analysis reports; baseline lacks --file, recorded not-measurable)",
    "host": "zcode (darwin arm64)",
    "model": "session default",
    "permissions_profile": "session default",
    "fixture_revision": "aiwork working tree (uncommitted, outside repo): temp/AIPPT专家-交付漏斗与积分消耗异常分析-20260916.md + temp/会话聚合分析-近7天全专家-20260910至0916.md",
    "repeat_count": 1,
    "suite_case_count": 4,
    "summary": {
      "acceptance_rate": 0.5,
      "first_pass_review_rate": 0.5,
      "correction_count": 0,
      "escaped_defects": 4,
      "permission_violations": 0,
      "unnecessary_delegation_count": 0,
      "tool_failures": 0,
      "latency_ms": 0
    },
    "uncertainty": "repeat_count=1；语料 case accepted=false 为能力缺失推定（基线无 --file/C14），escaped_defects=4 是能力零检出的派生记账而非行为测量；model/permissions_profile 记 session default（全部指标面为确定性检查）",
    "evidence_refs": [
      "records/bugs/2026-09-22/session-deliverable-jargon-scope-gap.md",
      "records/bugs/recurrence/session-deliverable-jargon-scope.md",
      "records/improvement/candidates/0.8.6.json",
      "measurement: none (method-level change, no instrumented business task)",
      "executed_by: supervisor (raw outputs retained in session)",
      "digest_note: artifact_digest 为候选树（含 0.8.6 delta）固定值；基线行为按 0.8.6 delta 应用前推定——C14 与 --file 不存在，条款无两形态规则与作用域声明",
      "summary_note: escaped_defects=4 指基线面（无 C14、无 --file）对真实缺陷语料的代号裸用形态零检出——缺陷逃逸而非工具故障；两个语料 case accepted=false 按能力缺失记（not-measurable），非行为失败"
    ]
  },
  "candidate_results": {
    "result_id": "RL-0.8.6-candidate",
    "source_kind": "candidate",
    "source_revision": "git:e32ef14 + uncommitted candidate (working tree at evaluation time: 0.8.5 ui-track delta + 0.8.6 expression-scope delta)",
    "artifact_digest": "sha256:4713e1a2050805d1aae9322c2ad04b30a9c6bef73fcd2cb9aaa8f80d55148121",
    "suite_revision": "tools/lab/doc_chain.py --self-test (26 baseline cases / 38 candidate cases) + validate.py all + unittest discover + --file corpus lint (aiwork analysis reports; baseline lacks --file, recorded not-measurable)",
    "host": "zcode (darwin arm64)",
    "model": "session default",
    "permissions_profile": "session default",
    "fixture_revision": "aiwork working tree (uncommitted, outside repo): temp/AIPPT专家-交付漏斗与积分消耗异常分析-20260916.md + temp/会话聚合分析-近7天全专家-20260910至0916.md",
    "repeat_count": 1,
    "suite_case_count": 4,
    "summary": {
      "acceptance_rate": 1.0,
      "first_pass_review_rate": 1.0,
      "correction_count": 0,
      "escaped_defects": 0,
      "permission_violations": 0,
      "unnecessary_delegation_count": 0,
      "tool_failures": 0,
      "latency_ms": 0
    },
    "uncertainty": "repeat_count=1；语料为仓外业务文件（sha256 前缀 2cffeac5a462b0fc/b0db2e6a089c4681/6c2f3c3840767d7b，N1 收口）；C14 非全召回（表格行豁免为已披露 floor 容差，:99 括注豁免）；非阻塞 N1-N8 留档于 EP-20260922-002 review_roundtrips，N4/N6 留后续批、N7 转人工门；C15 降级裁决证据=自测 case 34",
    "evidence_refs": [
      "records/improvement/candidates/0.8.6.json",
      "records/bugs/2026-09-22/session-deliverable-jargon-scope-gap.md",
      "measurement: none (method-level change, no instrumented business task)",
      "executed_by: supervisor 复跑全部确定性检查（candidate-engineer 声称的输出全部本机复现）；语料 --file 原始输出留存会话",
      "summary_note: defect-corpus-detection——--file 对 AIPPT 报告 exit 1、C14×4（:40 C 桶/:274 :280 :648 D 桶；:99 A 桶在括注内按成对形式豁免，属声明的 floor 容差）。corpus-precision-guard——姊妹报告 exit 0（撞墙/零交付属条款文本管辖非 C14 机器面，符合声明）；Youc 含『IP 桶』文件 exit 0 零误报。isolation blocked=[]；self-test 38/38；validate all 9 PASS；unittest 155 OK"
    ]
  },
  "evaluation_result": "better",
  "decision": "promote",
  "approvals": [
    {
      "actor": "agentflow:release-governor（agent_a627d3f6）",
      "decision": "approved",
      "evidence_ref": "promote（human-gated）附发盘条件：release record 必含 digest/语料 sha256/uncertainty/known-issues/回滚阈值/批准条目；门序=先批准 0.8.5；批准后重装+validate.py installed 留绿痕+台账回写 consolidated_in 0.8.6+BUG-20260922-01 回锚 fix_revision",
      "recorded_at": "2026-09-22T14:50:00+08:00"
    },
    {
      "actor": "user",
      "decision": "approved",
      "evidence_ref": "发布门 AskUserQuestion 答复（2026-09-22）：「两个都批准并发布」——覆盖 0.8.5+0.8.6 双候选",
      "recorded_at": "2026-09-22T14:55:00+08:00"
    }
  ],
  "rollout": {
    "mode": "human-gated",
    "task_slice": "下一次真实会话交付物（分析报告/状态汇报）为 regression_status=not-run 的首个对照面；0.8.6 工件叠加 0.8.5 delta 同批发布（manifests 直接落 0.8.6）",
    "rollback_thresholds": [
      "validate.py installed 失败",
      "干净语料 C14 误报>0 且无声明豁免",
      "下次会话交付物被用户报同型黑话缺陷"
    ]
  },
  "rollback_to": "0.8.4",
  "measurement": {
    "status": "none",
    "basis": "method-level change, no instrumented business task; evals/business 切片不覆盖会话交付物面"
  }
}