{
  "schema_version": 1,
  "candidate": {
    "schema_version": 1,
    "candidate_version": "0.8.5",
    "parent_version": "0.8.4",
    "source_revision": "git:e32ef14 + uncommitted candidate (working tree at evaluation time)",
    "hypothesis": "文档链对有独立设计流的目标仓（设计稿评审/品牌规范/多站点约定）缺 ui 轨支撑——UI 需求与视觉口径散落在 spec/fe 与会话纪律里，是 0.8.2 前文档链「存在但质量靠会话自觉」的同型缺口在 ui 维度的再现；在 document-chain-templates.md 增 spec/ui 与 design/ui 骨架（与 spec/fe、design/be|fe 家族同构：§0 反审 checklist、固定节标题、真源声明引用不复制、变更记录承载用户迭代）、document-chain.md 声明 ui 轨启用规则（proposal 保持单一、linter 只做存在性/围栏/时效性检查、形态质量靠反审+README 门禁兜底）后：目标仓可按固定骨架产出 ui 轨第一版并支持用户迭代，且不回归既有 linter/自测/全仓校验。评测口径：Youc 试点（feature-2026-09-19-office-agent）作为消费方在候选工具下 linter PASS；self-test 26/26 与 validate.py all 9 项 PASS 零回归；ui 骨架存在性与三要素同构由独立 evaluator 对照检查确认。method-level change; evals/business 切片不覆盖 ui 轨生成面——release record 须记 measurement: none (method-level change, no instrumented business task)",
    "evidence_ids": [
      "EP-20260922-001"
    ],
    "changed_components": [
      "skills/agentflow/references/document-chain.md",
      "skills/agentflow/references/document-chain-templates.md"
    ],
    "risk_class": "low",
    "evaluation_suite_revision": "git:e32ef14:tools/lab/doc_chain.py --self-test (26 cases) + validate.py all + consumer pilot lint (Youc docs/features/feature-2026-09-19-office-agent)",
    "primary_metrics": [
      "doc_chain_self_test_pass (26/26, 基线行为不回归)",
      "consumer_pilot_lint_pass (Youc 试点目录 PASS，含 ui 轨文件被 C1/C3/C10/C12/C13 扫描)",
      "ui_skeleton_coverage (candidate: spec/ui + design/ui 两节存在且含 §0 反审/自检/真源三要素; baseline: 0 节)"
    ],
    "guardrails": [
      "validate.py all 全绿（schemas/examples/evals/artifacts/mock/protected/manifests/docs/tests）",
      "isolation.py check-diff blocked=[]",
      "既有 C1-C13 自测 case 不回归（26/26）",
      "proposal 单一不分角色原则不被 ui 轨稀释（evaluator 第 7 项核实）"
    ],
    "rejection_criteria": [
      "任一 guardrail 失败",
      "ui 骨架与既有模板家族不同构（缺 §0 反审或真源声明）",
      "linter 在既有 26 case 上出现新失败"
    ],
    "protected_slices": [
      "role-selection",
      "architecture-and-safety",
      "artifact-verification"
    ],
    "artifact_digest": "sha256:e3edae0c49eee66dfa81354f914b08b27376d74dab0ca891b1a72ba90ebe39f0"
  },
  "baseline_results": {
    "result_id": "RL-0.8.5-baseline",
    "source_kind": "baseline",
    "source_revision": "git:e32ef14",
    "artifact_digest": "sha256:d8aaeac14de6dac3de4ed3da7a0b6bea3d7134b4aa3eac1215e8740d9139b0d4",
    "suite_revision": "tools/lab/doc_chain.py --self-test (26 cases) + validate.py all + Youc consumer pilot lint",
    "host": "zcode (darwin arm64)",
    "model": "session default",
    "permissions_profile": "session default",
    "fixture_revision": "Youc@feature-ui-showcase working tree (uncommitted): docs/features/feature-2026-09-19-office-agent/",
    "repeat_count": 1,
    "suite_case_count": 3,
    "summary": {
      "acceptance_rate": 0.67,
      "first_pass_review_rate": 0.33,
      "correction_count": 1,
      "escaped_defects": 0,
      "permission_violations": 0,
      "unnecessary_delegation_count": 0,
      "tool_failures": 0,
      "latency_ms": 0
    },
    "uncertainty": "repeat_count=1；ui_skeleton_coverage accepted=false 为能力缺失（基线无 ui 骨架）非行为失败；correction_count=1 来自 Youc 试点 C5 修复轮过程遥测",
    "evidence_refs": [
      "records/episodes/2026-09-22/EP-20260922-001.json",
      "records/improvement/candidates/0.8.5.json",
      "measurement: none (method-level change, no instrumented business task)",
      "executed_by: supervisor per evaluator-authored protocol (evaluator subagent has no shell; raw outputs retained in session)"
    ]
  },
  "candidate_results": {
    "result_id": "RL-0.8.5-candidate",
    "source_kind": "candidate",
    "source_revision": "git:e32ef14 + uncommitted candidate (document-chain-templates.md spec/ui+design/ui 骨架、document-chain.md UI 轨条款；含 evaluator 修复轮：措辞收窄/自检节编号对齐家族；及命名规范段（角色目录镜像式，用户反馈驱动）)",
    "artifact_digest": "sha256:e3edae0c49eee66dfa81354f914b08b27376d74dab0ca891b1a72ba90ebe39f0",
    "suite_revision": "tools/lab/doc_chain.py --self-test (26 cases) + validate.py all + Youc consumer pilot lint",
    "host": "zcode (darwin arm64)",
    "model": "session default",
    "permissions_profile": "session default",
    "fixture_revision": "Youc@feature-ui-showcase working tree (uncommitted): docs/features/feature-2026-09-19-office-agent/",
    "repeat_count": 1,
    "suite_case_count": 3,
    "summary": {
      "acceptance_rate": 1.0,
      "first_pass_review_rate": 0.67,
      "correction_count": 3,
      "escaped_defects": 0,
      "permission_violations": 0,
      "unnecessary_delegation_count": 0,
      "tool_failures": 0,
      "latency_ms": 0
    },
    "uncertainty": "repeat_count=1；单消费方试点（Youc office-agent）；evaluator 协议项号引用以 agent_85e2b39d 报告原文为准；correction_count=3 为两轮修复轮过程遥测（evaluator 4 项 + reviewer 7 项），非质量门失败；发布树在评估树之上叠加已批准的 0.8.6 delta，本记录背 0.8.5 面（digest sha256:e3edae0c… 为叠加前冻结值）",
    "evidence_refs": [
      "records/episodes/2026-09-22/EP-20260922-001.json",
      "records/improvement/candidates/0.8.5.json",
      "measurement: none (method-level change, no instrumented business task)",
      "executed_by: supervisor per evaluator-authored protocol (evaluator subagent has no shell; raw outputs retained in session)"
    ]
  },
  "evaluation_result": "better",
  "decision": "promote",
  "approvals": [
    {
      "actor": "agentflow:release-governor（agent_03dcb015）",
      "decision": "approved",
      "evidence_ref": "promote 附发盘条件：digest 口径、uncertainty 收口、密度台账判定（0.8.5 ui 缺口不构成 doc-chain-generation-density 类 occurrence——无 ui 密度/cram 缺陷实例，缺口=模板族覆盖面而非密度失效，按条件 6(b) 明文记载不增 occurrences）、门序先于 0.8.6",
      "recorded_at": "2026-09-22T15:05:00+08:00"
    },
    {
      "actor": "user",
      "decision": "approved",
      "evidence_ref": "发布门 AskUserQuestion 答复（2026-09-22）：「两个都批准并发布」——覆盖 0.8.5+0.8.6 双候选",
      "recorded_at": "2026-09-22T14:55:00+08:00"
    }
  ],
  "rollout": {
    "mode": "human-gated",
    "task_slice": "下一次 ui 轨文档链（Youc office-agent 后续迭代或同等业务仓）为首个对照面。单批双发说明：0.8.5 与 0.8.6 同批发布，manifests 直接落 0.8.6，未安装 0.8.5 中间快照（同批内无运行窗口），两代回滚目标均为 0.8.4",
    "rollback_thresholds": [
      "validate.py installed 失败",
      "ui 轨骨架在下次文档链引发模板冲突或评审同型缺陷",
      "ui 轨条款被用户报黑话/密度同型缺陷"
    ]
  },
  "rollback_to": "0.8.4",
  "measurement": {
    "status": "none",
    "basis": "method-level change, no instrumented business task; evals/business 切片不覆盖 ui 轨生成面"
  }
}